{
  "schemaVersion": "1.0",
  "runId": "example-factory-2030-01-07-a",
  "factory": {
    "name": "Example Factory",
    "version": "0.9.2",
    "models": ["model-large", "model-small"],
    "configuration": { "parallelTickets": 2, "autoMerge": false }
  },
  "baseline": {
    "repository": "github.com/example/clinic-scheduler",
    "tag": "baseline-v1",
    "commit": "118de1c"
  },
  "operator": "evaluator-1",
  "startedAt": "2030-01-07T09:00:00Z",
  "finishedAt": "2030-01-07T13:30:00Z",
  "wallClockSeconds": 16200,
  "activeSeconds": 15300,
  "finalCommit": "abc1234",
  "tickets": [
    {
      "ticketId": "T1",
      "status": "completed",
      "startedAt": "2030-01-07T09:00:00Z",
      "finishedAt": "2030-01-07T09:20:00Z",
      "wallClockSeconds": 1200,
      "tokens": { "input": 420000, "output": 18000, "cacheRead": 300000, "cacheWrite": 40000 },
      "costUsd": 1.85,
      "agentInvocations": 2,
      "pullRequests": [
        {
          "id": "#1",
          "title": "T1: add waitlist schema",
          "branch": "t1-waitlist-schema",
          "headCommit": "1111111",
          "openedAt": "2030-01-07T09:15:00Z",
          "mergedAt": "2030-01-07T09:20:00Z",
          "state": "merged",
          "linesAdded": 64,
          "linesDeleted": 0,
          "filesChanged": 2,
          "commits": 1,
          "ciRuns": 1,
          "ciFailures": 0,
          "reviewRounds": 0,
          "ciGreenAtMerge": true
        }
      ],
      "humanInterventions": [],
      "hiddenTests": { "http": { "passed": 5, "total": 5 }, "e2e": { "passed": 0, "total": 0 } }
    },
    {
      "ticketId": "T7",
      "status": "completed",
      "tokens": { "input": 610000, "output": 25000 },
      "costUsd": 2.4,
      "pullRequests": [],
      "humanInterventions": [
        {
          "at": "2030-01-07T12:40:00Z",
          "ticketId": "T7",
          "kind": "clarification",
          "initiatedBy": "factory",
          "durationMinutes": 4,
          "description": "Asked which offer events should trigger notifications; told to use its judgement."
        }
      ],
      "clarifyingQuestions": ["Which offer events should send a notification?"]
    }
  ],
  "humanInterventions": [
    {
      "at": "2030-01-07T10:05:00Z",
      "kind": "unblock",
      "initiatedBy": "human",
      "durationMinutes": 11,
      "description": "Restarted a hung Playwright install in the factory sandbox."
    }
  ],
  "hiddenTests": {
    "http": { "passed": 58, "total": 61 },
    "e2e": { "passed": 11, "total": 12 },
    "commit": "abc1234"
  },
  "totals": {
    "tokens": { "input": 5200000, "output": 210000, "cacheRead": 3900000, "cacheWrite": 400000 },
    "costUsd": 24.75,
    "pullRequests": 8,
    "pullRequestsMerged": 8,
    "ciRuns": 14,
    "ciFailures": 3,
    "humanInterventions": 2,
    "humanMinutes": 15
  },
  "notes": "Illustrative only; numbers are made up."
}
